<?xml version="1.0" encoding="UTF-8"?>
<xsd:schema xmlns:xsd="http://www.w3.org/2001/XMLSchema">

    <xsd:element name="storage">
        <xsd:complexType>
            <xsd:sequence>
                <xsd:element name="category" maxOccurs="unbounded">
                    <xsd:complexType>
                        <xsd:sequence>
                            <xsd:element name="subcategory" maxOccurs="unbounded">
                                <xsd:complexType>
                                    <xsd:sequence>
                                        <xsd:element name="product" type="characteristic" maxOccurs="unbounded"/>
                                    </xsd:sequence>
                                    <xsd:attribute name="name" use="required"/>
                                </xsd:complexType>
                            </xsd:element>
                        </xsd:sequence>
                        <xsd:attribute name="name" use="required"/>
                    </xsd:complexType>
                </xsd:element>
            </xsd:sequence>
        </xsd:complexType>
    </xsd:element>

    <xsd:complexType name="characteristic">
        <xsd:sequence>
            <xsd:element name="maker" type="xsd:string"/>
            <xsd:element name="model">
                <xsd:simpleType>
                    <xsd:restriction base="xsd:string">
                        <xsd:pattern value="[a-zA-Z]{2}[0-9]{3}"/>
                    </xsd:restriction>
                </xsd:simpleType>
            </xsd:element>
            <xsd:element name="productionDate" type="xsd:date"/>
            <xsd:element name="color" type="xsd:string"/>
            <xsd:element name="price">
                <xsd:complexType>
                    <xsd:simpleContent>
                        <xsd:extension base="xsd:double">
                            <xsd:attribute name="available" type="xsd:boolean" use="required"/>
                        </xsd:extension>
                    </xsd:simpleContent>
                </xsd:complexType>
            </xsd:element>
        </xsd:sequence>
    </xsd:complexType>
</xsd:schema>